{
  "schema_version": 1,
  "fixture_set_id": "temporal-span-registry-media-sidecar-foundation-20260430",
  "schema_ref": "schemas/temporal-span-registry.schema.json",
  "generated_from": [
    "spec:2026-04-30-canonical-temporal-grounding-ontology",
    "audit:2026-04-30-temporal-bands-perceptual-grounding-responsible-synthesis",
    "shared:world-surface-health-fixtures"
  ],
  "declared_at": "2026-04-30T02:24:00Z",
  "producer": "cx-amber",
  "required_sidecar_kinds": [
    "camera_jpeg",
    "hls_segment",
    "audio_window",
    "scene_detection",
    "ir_report",
    "vad_transition",
    "reverie_content",
    "replay_span",
    "context_state"
  ],
  "fail_closed_policy": {
    "mtime_is_join_key": false,
    "missing_span_refs_allow_claim_bearing_output": false,
    "diagnostic_records_are_dropped_on_missing_span_refs": false,
    "private_spans_can_ground_public_claims": false,
    "rights_blocked_spans_can_ground_public_claims": false
  },
  "spans": [
    {
      "schema_version": 1,
      "span_id": "span:archive.hls.segment00042",
      "span_kind": "archive_segment_span",
      "source_id": "archive:hls:2026-04-30:segment00042",
      "source_kind": "hls_segment",
      "producer": "studio_compositor",
      "clock_domain": "hls_media_time_ns",
      "observed_start_ns": 10000000000,
      "observed_end_ns": 12000000000,
      "ingested_at_ns": 12050000000,
      "sequence_ids": ["hls-segment-00042"],
      "capture_session_id": "capture-session:studio:2026-04-30",
      "cadence_s": 2.0,
      "validity_start_ns": 10000000000,
      "validity_until_ns": 15000000000,
      "source_span_refs": [
        "span:audio.broadcast.window.0042",
        "span:camera.main.frame.1024",
        "span:scene.detector.window.0042",
        "span:reverie.content.slot.0042"
      ],
      "source_refs": [
        "hls:studio:segment00042",
        "sidecar:hls:segment00042"
      ],
      "transform": "studio-compositor hls archive segment from aligned audio/video/context spans",
      "privacy_label": "public_safe",
      "rights_class": "public_clear",
      "content_hash": "sha256:aaaaaaaaaaaaaaaaaaaaaaaaaaaaaaaaaaaaaaaaaaaaaaaaaaaaaaaaaaaaaaaa",
      "artifact_path": "/archive/hls/2026-04-30/segment00042.ts",
      "metadata": {
        "playlist_ref": "hls:studio:index.m3u8",
        "duration_s": 2.0,
        "join_key": "temporal_span_overlap",
        "clock_domain_mapping_ref": "clock-map:studio-session-2026-04-30"
      }
    },
    {
      "schema_version": 1,
      "span_id": "span:camera.main.frame.1024",
      "span_kind": "frame_exposure",
      "source_id": "camera:main:frame1024",
      "source_kind": "camera_jpeg",
      "producer": "studio_compositor",
      "clock_domain": "camera_exposure_clock_ns",
      "observed_start_ns": 10500000000,
      "observed_end_ns": 10533333333,
      "ingested_at_ns": 10600000000,
      "sequence_ids": ["camera-main-frame-1024"],
      "capture_session_id": "capture-session:studio:2026-04-30",
      "cadence_s": 0.033333333,
      "validity_start_ns": 10500000000,
      "validity_until_ns": 13500000000,
      "source_span_refs": [],
      "source_refs": [
        "camera:main",
        "frame:camera-main:1024"
      ],
      "transform": "camera exposure JPEG sidecar",
      "privacy_label": "public_safe",
      "rights_class": "public_clear",
      "content_hash": "sha256:bbbbbbbbbbbbbbbbbbbbbbbbbbbbbbbbbbbbbbbbbbbbbbbbbbbbbbbbbbbbbbbb",
      "artifact_path": "/archive/camera/main/2026-04-30/frame1024.jpg",
      "metadata": {
        "width": 1920,
        "height": 1080,
        "face_obscure_ref": "privacy:face-obscure:public-safe",
        "join_key": "temporal_span_overlap",
        "clock_domain_mapping_ref": "clock-map:studio-session-2026-04-30"
      }
    },
    {
      "schema_version": 1,
      "span_id": "span:audio.broadcast.window.0042",
      "span_kind": "sample_window",
      "source_id": "audio:broadcast:window0042",
      "source_kind": "audio_window",
      "producer": "hapax_daimonion",
      "clock_domain": "audio_sample_clock_ns",
      "observed_start_ns": 10000000000,
      "observed_end_ns": 12000000000,
      "ingested_at_ns": 12025000000,
      "sequence_ids": ["audio-window-0042"],
      "capture_session_id": "capture-session:studio:2026-04-30",
      "cadence_s": 2.0,
      "validity_start_ns": 10000000000,
      "validity_until_ns": 13500000000,
      "source_span_refs": [],
      "source_refs": [
        "audio:broadcast-master",
        "vad:window0042"
      ],
      "transform": "broadcast audio analysis window",
      "privacy_label": "public_safe",
      "rights_class": "public_clear",
      "content_hash": "sha256:cccccccccccccccccccccccccccccccccccccccccccccccccccccccccccccccc",
      "artifact_path": "/archive/audio/2026-04-30/broadcast-window0042.flac",
      "metadata": {
        "sample_rate_hz": 48000,
        "channels": 2,
        "join_key": "temporal_span_overlap",
        "clock_domain_mapping_ref": "clock-map:studio-session-2026-04-30"
      }
    },
    {
      "schema_version": 1,
      "span_id": "span:scene.detector.window.0042",
      "span_kind": "classification_window",
      "source_id": "scene:detector:window0042",
      "source_kind": "scene_detection",
      "producer": "environmental_perception",
      "clock_domain": "derived_span_ns",
      "observed_start_ns": 9900000000,
      "observed_end_ns": 12400000000,
      "ingested_at_ns": 12450000000,
      "sequence_ids": ["scene-window-0042"],
      "capture_session_id": "capture-session:studio:2026-04-30",
      "cadence_s": 2.5,
      "validity_start_ns": 9900000000,
      "validity_until_ns": 15400000000,
      "source_span_refs": ["span:camera.main.frame.1024"],
      "source_refs": [
        "scene-detector:studio",
        "frame:camera-main:1024"
      ],
      "transform": "scene detection window over camera frame exposure",
      "privacy_label": "public_safe",
      "rights_class": "public_clear",
      "content_hash": "sha256:dddddddddddddddddddddddddddddddddddddddddddddddddddddddddddddddd",
      "artifact_path": "/archive/scene/2026-04-30/window0042.json",
      "metadata": {
        "labels": ["desk", "monitor", "operator-obscured"],
        "join_key": "temporal_span_overlap",
        "clock_domain_mapping_ref": "clock-map:studio-session-2026-04-30"
      }
    },
    {
      "schema_version": 1,
      "span_id": "span:ir.presence.window.0042",
      "span_kind": "sample_window",
      "source_id": "ir:presence:window0042",
      "source_kind": "ir_report",
      "producer": "hapax_daimonion",
      "clock_domain": "monotonic_ns",
      "observed_start_ns": 9500000000,
      "observed_end_ns": 12500000000,
      "ingested_at_ns": 12520000000,
      "sequence_ids": ["ir-report-0042"],
      "capture_session_id": "capture-session:studio:2026-04-30",
      "cadence_s": 3.0,
      "validity_start_ns": 9500000000,
      "validity_until_ns": 14500000000,
      "source_span_refs": [],
      "source_refs": [
        "ir:presence-sensor",
        "health:ir-presence"
      ],
      "transform": "IR presence report window",
      "privacy_label": "private_only",
      "rights_class": "private_only",
      "content_hash": "sha256:eeeeeeeeeeeeeeeeeeeeeeeeeeeeeeeeeeeeeeeeeeeeeeeeeeeeeeeeeeeeeeee",
      "artifact_path": "/archive/ir/2026-04-30/presence-window0042.json",
      "metadata": {
        "presence_state": "present",
        "join_key": "temporal_span_overlap",
        "clock_domain_mapping_ref": "clock-map:studio-session-2026-04-30"
      }
    },
    {
      "schema_version": 1,
      "span_id": "span:vad.transition.speech-start.0042",
      "span_kind": "instant_event",
      "source_id": "vad:transition:speech-start0042",
      "source_kind": "vad_transition",
      "producer": "hapax_daimonion",
      "clock_domain": "audio_sample_clock_ns",
      "observed_start_ns": 10900000000,
      "observed_end_ns": 10900000000,
      "ingested_at_ns": 10905000000,
      "sequence_ids": ["vad-transition-0042"],
      "capture_session_id": "capture-session:studio:2026-04-30",
      "cadence_s": null,
      "validity_start_ns": 10900000000,
      "validity_until_ns": 13000000000,
      "source_span_refs": ["span:audio.broadcast.window.0042"],
      "source_refs": [
        "vad:broadcast-master",
        "audio:broadcast-master"
      ],
      "transform": "VAD state transition event derived from audio window",
      "privacy_label": "public_safe",
      "rights_class": "public_clear",
      "content_hash": "sha256:ffffffffffffffffffffffffffffffffffffffffffffffffffffffffffffffff",
      "artifact_path": "/archive/vad/2026-04-30/transition0042.json",
      "metadata": {
        "transition": "speech_start",
        "join_key": "temporal_span_overlap",
        "clock_domain_mapping_ref": "clock-map:studio-session-2026-04-30"
      }
    },
    {
      "schema_version": 1,
      "span_id": "span:reverie.content.slot.0042",
      "span_kind": "composition_span",
      "source_id": "reverie:content:slot0042",
      "source_kind": "reverie_content",
      "producer": "reverie",
      "clock_domain": "derived_span_ns",
      "observed_start_ns": 10050000000,
      "observed_end_ns": 11950000000,
      "ingested_at_ns": 11980000000,
      "sequence_ids": ["reverie-content-0042"],
      "capture_session_id": "capture-session:studio:2026-04-30",
      "cadence_s": 1.9,
      "validity_start_ns": 10050000000,
      "validity_until_ns": 15000000000,
      "source_span_refs": [],
      "source_refs": [
        "reverie:content-layer",
        "visual-chain:current"
      ],
      "transform": "Reverie content layer active interval",
      "privacy_label": "public_safe",
      "rights_class": "public_clear",
      "content_hash": "sha256:1111111111111111111111111111111111111111111111111111111111111111",
      "artifact_path": "/archive/reverie/2026-04-30/content-slot0042.json",
      "metadata": {
        "material": "void",